{
  "framework_id": "owasp-api-top10",
  "name": "OWASP API Security Top 10",
  "version": "2023",
  "publisher": "OWASP Foundation",
  "category": "best-practice",
  "description": "The most critical API security risks, mapped to Azure mitigations. Summaries are paraphrased.",
  "reference_url": "https://owasp.org/API-Security/",
  "controls": [
    {"control_id":"API1","title":"Broken Object Level Authorization","summary":"APIs expose object IDs without verifying the caller may access that specific object.","severity":"critical","domain":"API Security","azure_services":["apim"],"remediation":"Check ownership/authorization on every object access server-side; use unpredictable IDs as defense in depth; test BOLA in CI.","stride":["information-disclosure","elevation-of-privilege"],"attack_techniques":["T1078"],"crosswalk":[{"framework_id":"nist-800-53","control_id":"AC-3"}]},
    {"control_id":"API2","title":"Broken Authentication","summary":"Flawed token handling or weak flows let attackers assume other identities.","severity":"critical","domain":"API Security","azure_services":["entra-id","apim"],"remediation":"Validate Entra ID JWTs (issuer, audience, signature, expiry) on every request; short token lifetimes; APIM validate-jwt policy.","stride":["spoofing"],"attack_techniques":["T1078"],"crosswalk":[{"framework_id":"owasp-web-top10","control_id":"A07"}]},
    {"control_id":"API3","title":"Broken Object Property Level Authorization","summary":"APIs expose or accept object properties the caller should not read or write (excessive data exposure / mass assignment).","severity":"high","domain":"API Security","azure_services":[],"remediation":"Use explicit response DTOs and input schemas (Pydantic), never bind requests directly to data models.","stride":["information-disclosure","tampering"],"attack_techniques":[],"crosswalk":[{"framework_id":"nist-800-53","control_id":"AC-3"}]},
    {"control_id":"API4","title":"Unrestricted Resource Consumption","summary":"Missing rate limits and quotas enable DoS and cost abuse.","severity":"high","domain":"API Security","azure_services":["apim","front-door"],"remediation":"APIM rate-limit and quota policies, request size limits, pagination caps, and autoscale with budget alerts.","stride":["denial-of-service"],"attack_techniques":["T1499"],"crosswalk":[{"framework_id":"owasp-llm-top10","control_id":"LLM10"}]},
    {"control_id":"API5","title":"Broken Function Level Authorization","summary":"Administrative or privileged endpoints lack role checks.","severity":"critical","domain":"API Security","azure_services":[],"remediation":"Enforce role checks (app roles) per endpoint with deny-by-default routing; separate admin API surface.","stride":["elevation-of-privilege"],"attack_techniques":["T1078"],"crosswalk":[{"framework_id":"nist-800-53","control_id":"AC-6"}]},
    {"control_id":"API6","title":"Unrestricted Access to Sensitive Business Flows","summary":"Legitimate flows (purchasing, posting) are abused at scale without anti-automation controls.","severity":"medium","domain":"API Security","azure_services":["front-door","app-gateway-waf"],"remediation":"Bot protection at the edge, per-account velocity limits, and business-flow anomaly monitoring.","stride":["denial-of-service"],"attack_techniques":["T1499"],"crosswalk":[{"framework_id":"nist-800-53","control_id":"SC-5"}]},
    {"control_id":"API7","title":"Server-Side Request Forgery","summary":"APIs fetching user-supplied URLs can be steered at internal targets.","severity":"high","domain":"API Security","azure_services":[],"remediation":"Allow-list outbound hosts, block metadata endpoints, and isolate fetching components in restricted egress subnets.","stride":["information-disclosure"],"attack_techniques":["T1190"],"crosswalk":[{"framework_id":"owasp-web-top10","control_id":"A10"}]},
    {"control_id":"API8","title":"Security Misconfiguration","summary":"Missing hardening across the API stack: verbose errors, permissive CORS, absent headers.","severity":"high","domain":"API Security","azure_services":[],"remediation":"Strict CORS, security headers, sanitized errors, disable unused HTTP verbs, config scanning in CI.","stride":["information-disclosure"],"attack_techniques":[],"crosswalk":[{"framework_id":"owasp-web-top10","control_id":"A05"}]},
    {"control_id":"API9","title":"Improper Inventory Management","summary":"Forgotten API versions and undocumented endpoints stay exposed and unpatched.","severity":"medium","domain":"API Security","azure_services":["apim"],"remediation":"Catalog all APIs in APIM, retire old versions with sunset policies, and generate OpenAPI docs from code.","stride":["information-disclosure"],"attack_techniques":["T1190"],"crosswalk":[{"framework_id":"nist-800-53","control_id":"CM-2"}]},
    {"control_id":"API10","title":"Unsafe Consumption of APIs","summary":"Downstream/third-party API responses are trusted blindly, propagating injection or bad data.","severity":"medium","domain":"API Security","azure_services":[],"remediation":"Validate and sanitize third-party responses against schemas, apply timeouts/circuit breakers, and pin TLS.","stride":["tampering"],"attack_techniques":["T1195"],"crosswalk":[{"framework_id":"owasp-llm-top10","control_id":"LLM05"}]}
  ]
}
