{
  "framework_id": "owasp-web-top10",
  "name": "OWASP Top 10 Web Application Security Risks",
  "version": "2021",
  "publisher": "OWASP Foundation",
  "category": "best-practice",
  "description": "The most critical web application security risks, mapped to Azure mitigations. Summaries are paraphrased.",
  "reference_url": "https://owasp.org/Top10/",
  "controls": [
    {"control_id":"A01","title":"Broken Access Control","summary":"Users can act outside their intended permissions due to missing or flawed authorization checks.","severity":"critical","domain":"Application Security","azure_services":["app-service","apim"],"remediation":"Enforce server-side authorization on every route, deny by default, use Entra ID app roles, and test with automated authz suites.","stride":["elevation-of-privilege"],"attack_techniques":["T1078"],"crosswalk":[{"framework_id":"nist-800-53","control_id":"AC-3"}]},
    {"control_id":"A02","title":"Cryptographic Failures","summary":"Sensitive data is exposed through weak or missing encryption in transit or at rest.","severity":"high","domain":"Application Security","azure_services":[],"remediation":"TLS 1.2+ everywhere, HSTS, platform encryption at rest, secrets in Key Vault, no custom crypto.","stride":["information-disclosure"],"attack_techniques":["T1557"],"crosswalk":[{"framework_id":"mcsb","control_id":"DP-3"}]},
    {"control_id":"A03","title":"Injection","summary":"Untrusted data alters queries or commands (SQLi, XSS, command injection).","severity":"critical","domain":"Application Security","azure_services":["app-gateway-waf"],"remediation":"Parameterized queries/ORM, output encoding, strict input validation, WAF managed rules as defense in depth.","stride":["tampering"],"attack_techniques":["T1190"],"crosswalk":[{"framework_id":"nist-800-53","control_id":"SI-2"}]},
    {"control_id":"A04","title":"Insecure Design","summary":"Missing security requirements and threat modeling produce architecturally unsafe systems.","severity":"high","domain":"Application Security","azure_services":[],"remediation":"Threat model (STRIDE) during design, define abuse cases, and adopt secure design patterns and reference architectures.","stride":["tampering","information-disclosure"],"attack_techniques":[],"crosswalk":[{"framework_id":"nist-csf","control_id":"ID.RA"}]},
    {"control_id":"A05","title":"Security Misconfiguration","summary":"Insecure defaults, open cloud storage, verbose errors, or missing hardening expose the system.","severity":"high","domain":"Application Security","azure_services":[],"remediation":"Harden via IaC baselines, Azure Policy enforcement, disable unused features, and scan configs in CI.","stride":["information-disclosure"],"attack_techniques":["T1530"],"crosswalk":[{"framework_id":"nist-800-53","control_id":"CM-6"}]},
    {"control_id":"A06","title":"Vulnerable and Outdated Components","summary":"Known-vulnerable dependencies and images are exploitable.","severity":"high","domain":"Application Security","azure_services":[],"remediation":"SCA and container scanning in CI (Trivy), patch SLAs, and Defender vulnerability management in runtime.","stride":["tampering"],"attack_techniques":["T1190"],"crosswalk":[{"framework_id":"nist-800-53","control_id":"SI-2"}]},
    {"control_id":"A07","title":"Identification and Authentication Failures","summary":"Weak authentication enables credential stuffing, session hijacking, and account takeover.","severity":"high","domain":"Application Security","azure_services":["entra-id"],"remediation":"Delegate auth to Entra ID (OIDC), enforce MFA, secure session handling, and risk-based sign-in policies.","stride":["spoofing"],"attack_techniques":["T1110","T1078"],"crosswalk":[{"framework_id":"nist-800-53","control_id":"IA-2"}]},
    {"control_id":"A08","title":"Software and Data Integrity Failures","summary":"Unverified updates, CI/CD tampering, or insecure deserialization compromise integrity.","severity":"high","domain":"Application Security","azure_services":[],"remediation":"Signed artifacts, protected branches, OIDC-based deploys (no long-lived secrets), and integrity checks on pipelines.","stride":["tampering"],"attack_techniques":["T1195"],"crosswalk":[{"framework_id":"nist-800-53","control_id":"CM-2"}]},
    {"control_id":"A09","title":"Security Logging and Monitoring Failures","summary":"Insufficient logging delays breach detection and response.","severity":"medium","domain":"Application Security","azure_services":["log-analytics"],"remediation":"Structured security logging to Log Analytics, alerting on auth anomalies, and tested incident escalation paths.","stride":["repudiation"],"attack_techniques":["T1070"],"crosswalk":[{"framework_id":"nist-800-53","control_id":"AU-2"}]},
    {"control_id":"A10","title":"Server-Side Request Forgery","summary":"The server is tricked into making requests to unintended destinations, often internal services or metadata endpoints.","severity":"high","domain":"Application Security","azure_services":[],"remediation":"Allow-list outbound destinations, block link-local metadata addresses, validate and normalize URLs, and segment egress via Azure Firewall.","stride":["information-disclosure","elevation-of-privilege"],"attack_techniques":["T1190"],"crosswalk":[{"framework_id":"nist-800-53","control_id":"SC-7"}]}
  ]
}
