{
  "framework_id": "owasp-llm-top10",
  "name": "OWASP Top 10 for LLM Applications",
  "version": "2025",
  "publisher": "OWASP Foundation",
  "category": "ai-governance",
  "description": "Top risks for applications built on large language models. Applies both to user architectures containing AI workloads and to this application itself (see docs/ai-governance/). Summaries are paraphrased.",
  "reference_url": "https://owasp.org/www-project-top-10-for-large-language-model-applications/",
  "controls": [
    {"control_id":"LLM01","title":"Prompt Injection","summary":"Attacker-controlled input (direct or embedded in retrieved content) manipulates the model into ignoring instructions or misusing tools.","severity":"critical","domain":"AI Security","azure_services":["azure-openai"],"check_hints":[{"target":"azure-openai","property":"input_filtering","condition":"equals","value":true,"fail_message":"AI workload has no input filtering or prompt-injection defenses."}],"remediation":"Segregate system instructions from user content, treat all retrieved/tool content as untrusted, apply input classifiers and Azure AI Content Safety Prompt Shields, and require human confirmation for consequential actions.","stride":["tampering","elevation-of-privilege"],"attack_techniques":["AML.T0051"],"crosswalk":[{"framework_id":"mitre-attack-azure","control_id":"AML.T0051"}]},
    {"control_id":"LLM02","title":"Sensitive Information Disclosure","summary":"The model reveals confidential data from its context, training, or connected systems.","severity":"high","domain":"AI Security","azure_services":["azure-openai"],"remediation":"Minimize sensitive data in prompts, apply output filtering/DLP, scope tool access per user authorization, and log disclosures for review.","stride":["information-disclosure"],"attack_techniques":["AML.T0057"],"crosswalk":[{"framework_id":"nist-800-53","control_id":"AC-3"}]},
    {"control_id":"LLM03","title":"Supply Chain Vulnerabilities","summary":"Compromised models, datasets, plugins, or packages undermine the application.","severity":"high","domain":"AI Security","azure_services":["azure-openai"],"remediation":"Use vetted model providers (Azure OpenAI), pin dependencies, scan packages/containers in CI, and maintain an AI bill of materials.","stride":["tampering"],"attack_techniques":["AML.T0010"],"crosswalk":[{"framework_id":"owasp-web-top10","control_id":"A06"}]},
    {"control_id":"LLM04","title":"Data and Model Poisoning","summary":"Manipulated training or grounding data induces harmful or biased model behavior.","severity":"medium","domain":"AI Security","azure_services":["azure-openai"],"remediation":"Control provenance of fine-tuning/RAG data, validate and version datasets, and monitor output drift with evaluations.","stride":["tampering"],"attack_techniques":["AML.T0020"],"crosswalk":[{"framework_id":"nist-800-53","control_id":"SI-4"}]},
    {"control_id":"LLM05","title":"Improper Output Handling","summary":"Model output is passed to downstream systems (browsers, shells, SQL) without validation, enabling injection attacks.","severity":"high","domain":"AI Security","azure_services":["azure-openai"],"remediation":"Treat model output as untrusted input: encode for the destination context, validate against schemas, and never execute generated code or queries without sandboxing.","stride":["tampering","elevation-of-privilege"],"attack_techniques":["AML.T0053"],"crosswalk":[{"framework_id":"owasp-web-top10","control_id":"A03"}]},
    {"control_id":"LLM06","title":"Excessive Agency","summary":"The model is granted more tools, permissions, or autonomy than the task requires, amplifying the blast radius of manipulation.","severity":"high","domain":"AI Security","azure_services":["azure-openai"],"check_hints":[{"target":"azure-openai","property":"tool_allowlist","condition":"equals","value":true,"fail_message":"AI workload's tool access is not restricted by an allow-list."}],"remediation":"Allow-list tools per role, scope tool permissions to least privilege, require human approval for destructive actions, and audit every tool invocation.","stride":["elevation-of-privilege"],"attack_techniques":["AML.T0053"],"crosswalk":[{"framework_id":"nist-800-53","control_id":"AC-6"}]},
    {"control_id":"LLM07","title":"System Prompt Leakage","summary":"Secrets or sensitive logic embedded in system prompts are extracted by users.","severity":"medium","domain":"AI Security","azure_services":["azure-openai"],"remediation":"Never place credentials or security-critical logic in prompts; enforce controls server-side and assume prompts are readable.","stride":["information-disclosure"],"attack_techniques":["AML.T0051"],"crosswalk":[{"framework_id":"nist-800-53","control_id":"IA-5"}]},
    {"control_id":"LLM08","title":"Vector and Embedding Weaknesses","summary":"RAG stores can be poisoned or leak data across tenants through weak access controls on embeddings.","severity":"medium","domain":"AI Security","azure_services":["azure-openai","cosmos-db"],"remediation":"Apply per-tenant filtering and authorization on vector queries, validate ingested content, and monitor retrieval anomalies.","stride":["information-disclosure","tampering"],"attack_techniques":["AML.T0070"],"crosswalk":[{"framework_id":"nist-800-53","control_id":"AC-3"}]},
    {"control_id":"LLM09","title":"Misinformation","summary":"Confident but wrong output (hallucination) leads users to unsafe decisions.","severity":"medium","domain":"AI Security","azure_services":["azure-openai"],"remediation":"Ground responses in authoritative sources (framework data via tools), display provenance, run evaluation suites in CI, and label AI output clearly.","stride":["tampering"],"attack_techniques":["AML.T0062"],"crosswalk":[{"framework_id":"nist-csf","control_id":"ID.RA"}]},
    {"control_id":"LLM10","title":"Unbounded Consumption","summary":"Uncontrolled request volume or token usage causes denial of service or runaway cost.","severity":"medium","domain":"AI Security","azure_services":["azure-openai","apim"],"check_hints":[{"target":"azure-openai","property":"rate_limited","condition":"equals","value":true,"fail_message":"AI workload has no rate limiting or token budget controls."}],"remediation":"Enforce per-user rate limits and token budgets, set provisioned throughput alerts, and use APIM policies in front of Azure OpenAI.","stride":["denial-of-service"],"attack_techniques":["AML.T0034"],"crosswalk":[{"framework_id":"nist-800-53","control_id":"SC-5"}]}
  ]
}
