{
  "framework_id": "nist-csf",
  "name": "NIST Cybersecurity Framework",
  "version": "2.0",
  "publisher": "NIST",
  "category": "standard",
  "description": "Outcome-based cybersecurity framework organized by function (Govern, Identify, Protect, Detect, Respond, Recover). Representative subcategories mapped to Azure. Summaries are paraphrased.",
  "reference_url": "https://www.nist.gov/cyberframework",
  "controls": [
    {"control_id":"GV.RM","title":"Risk Management Strategy","summary":"Risk appetite and management processes are established and communicated.","severity":"medium","domain":"Govern","azure_services":[],"remediation":"Define cloud risk appetite, document exceptions, and review Defender for Cloud Secure Score against agreed targets.","stride":[],"attack_techniques":[],"crosswalk":[{"framework_id":"iso-27001","control_id":"A.5.1"}]},
    {"control_id":"ID.AM","title":"Asset Management","summary":"Assets (systems, data, services) are inventoried and classified.","severity":"medium","domain":"Identify","azure_services":[],"remediation":"Enforce tagging via Azure Policy, inventory with Azure Resource Graph, and classify data stores by sensitivity.","stride":[],"attack_techniques":[],"crosswalk":[{"framework_id":"iso-27001","control_id":"A.5.9"}]},
    {"control_id":"ID.RA","title":"Risk Assessment","summary":"Threats, vulnerabilities, and impacts are identified and analyzed.","severity":"medium","domain":"Identify","azure_services":["defender-for-cloud"],"remediation":"Run STRIDE threat modeling per workload, review Defender recommendations, and track risks in a register.","stride":[],"attack_techniques":[],"crosswalk":[{"framework_id":"owasp-web-top10","control_id":"A04"}]},
    {"control_id":"PR.AA","title":"Identity Management and Access Control","summary":"Access is limited to authorized users, processes, and devices via managed identity lifecycle and least privilege.","severity":"high","domain":"Protect","azure_services":["entra-id"],"remediation":"Centralize on Entra ID, enforce MFA and Conditional Access, use PIM, and run access reviews.","stride":["spoofing","elevation-of-privilege"],"attack_techniques":["T1078"],"crosswalk":[{"framework_id":"nist-800-53","control_id":"AC-2"}]},
    {"control_id":"PR.DS","title":"Data Security","summary":"Data at rest and in transit is protected consistent with its classification.","severity":"high","domain":"Protect","azure_services":["storage-account","azure-sql","key-vault"],"remediation":"Platform encryption plus CMK where required, TLS 1.2+, private endpoints for data services, DLP on egress paths.","stride":["information-disclosure"],"attack_techniques":["T1530"],"crosswalk":[{"framework_id":"mcsb","control_id":"DP-4"}]},
    {"control_id":"PR.PS","title":"Platform Security","summary":"Hardware, software, and services are hardened, patched, and securely configured.","severity":"high","domain":"Protect","azure_services":[],"remediation":"IaC baselines, Azure Policy enforcement, patch SLAs, and container image scanning before deploy.","stride":["tampering"],"attack_techniques":["T1190"],"crosswalk":[{"framework_id":"nist-800-53","control_id":"CM-6"}]},
    {"control_id":"DE.CM","title":"Continuous Monitoring","summary":"Systems and networks are monitored to find anomalies and potentially adverse events.","severity":"high","domain":"Detect","azure_services":["defender-for-cloud","log-analytics"],"check_hints":[{"target":"architecture","condition":"service-present","value":"defender-for-cloud","fail_message":"Architecture has no continuous security monitoring capability."}],"remediation":"Enable Defender plans across resource types and centralize telemetry in Log Analytics/Sentinel with analytics rules.","stride":["repudiation"],"attack_techniques":["T1562"],"crosswalk":[{"framework_id":"mcsb","control_id":"LT-1"}]},
    {"control_id":"DE.AE","title":"Adverse Event Analysis","summary":"Anomalies and alerts are analyzed to understand scope and impact.","severity":"medium","domain":"Detect","azure_services":["log-analytics"],"remediation":"Define triage runbooks, correlate with Sentinel incidents, and preserve evidence per retention policy.","stride":["repudiation"],"attack_techniques":[],"crosswalk":[{"framework_id":"nist-800-53","control_id":"AU-6"}]},
    {"control_id":"RS.MA","title":"Incident Management","summary":"Responses to detected incidents are managed through defined processes.","severity":"medium","domain":"Respond","azure_services":["defender-for-cloud"],"remediation":"Maintain IR plans with roles and severity matrix, automate containment via Logic Apps, and run post-incident reviews.","stride":[],"attack_techniques":[],"crosswalk":[{"framework_id":"nist-800-53","control_id":"IR-4"}]},
    {"control_id":"RC.RP","title":"Incident Recovery Plan Execution","summary":"Restoration activities are executed to return to normal operations.","severity":"medium","domain":"Recover","azure_services":[],"remediation":"Tested backups (Azure Backup), documented RTO/RPO, region-failover plans for critical services, and restore drills.","stride":["denial-of-service"],"attack_techniques":["T1490"],"crosswalk":[{"framework_id":"nist-800-53","control_id":"CP-9"}]}
  ]
}
