{
  "framework_id": "azure-waf",
  "name": "Azure Well-Architected Framework — Security Pillar",
  "version": "2024 (representative subset)",
  "publisher": "Microsoft",
  "category": "best-practice",
  "description": "Security design principles and recommendations from the Well-Architected Framework. Summaries are paraphrased.",
  "reference_url": "https://learn.microsoft.com/azure/well-architected/security/",
  "controls": [
    {"control_id":"SE:01","title":"Establish a security baseline","summary":"Workloads should define and continuously measure against a security baseline aligned to compliance needs.","severity":"medium","domain":"Security Pillar","azure_services":[],"remediation":"Adopt MCSB as the baseline via Azure Policy initiative and track Secure Score improvements per sprint.","stride":[],"attack_techniques":[],"crosswalk":[{"framework_id":"mcsb","control_id":"PV-2"}]},
    {"control_id":"SE:05","title":"Strict identity and access management","summary":"All access — human and workload — is authenticated, authorized, and time-scoped following least privilege.","severity":"high","domain":"Security Pillar","azure_services":["entra-id"],"remediation":"Entra ID everywhere, managed identities for workloads, PIM for privileged roles, and no standing broad access.","stride":["spoofing","elevation-of-privilege"],"attack_techniques":["T1078"],"crosswalk":[{"framework_id":"mcsb","control_id":"IM-1"}]},
    {"control_id":"SE:06","title":"Network isolation and segmentation","summary":"Traffic is controlled through segmentation, private connectivity, and inspection at trust boundaries.","severity":"high","domain":"Security Pillar","azure_services":["vnet","firewall","private-endpoint"],"check_hints":[{"target":"architecture","condition":"service-present","value":"private-endpoint","fail_message":"Data services are not isolated behind private connectivity."}],"remediation":"Hub-spoke VNets, private endpoints for PaaS data services, Azure Firewall egress inspection, deny-by-default NSGs.","stride":["information-disclosure"],"attack_techniques":["T1046"],"crosswalk":[{"framework_id":"mcsb","control_id":"NS-2"}]},
    {"control_id":"SE:07","title":"Encrypt data everywhere","summary":"Data is encrypted in transit, at rest, and where feasible in use, with managed key lifecycle.","severity":"high","domain":"Security Pillar","azure_services":["key-vault"],"remediation":"TLS 1.2+, platform SSE with CMK where required, Key Vault-managed rotation, confidential computing for high-sensitivity workloads.","stride":["information-disclosure"],"attack_techniques":["T1005"],"crosswalk":[{"framework_id":"mcsb","control_id":"DP-4"}]},
    {"control_id":"SE:08","title":"Harden resources","summary":"Reduce attack surface by removing unused features, endpoints, and permissions.","severity":"medium","domain":"Security Pillar","azure_services":[],"remediation":"Disable FTP/remote debugging on App Service, remove public endpoints, minimal container base images, and close unused ports.","stride":["tampering"],"attack_techniques":["T1190"],"crosswalk":[{"framework_id":"owasp-web-top10","control_id":"A05"}]},
    {"control_id":"SE:10","title":"Monitor with a threat-informed strategy","summary":"Telemetry, detection, and alerting are designed around realistic threats to the workload.","severity":"high","domain":"Security Pillar","azure_services":["defender-for-cloud","log-analytics"],"remediation":"Map detections to ATT&CK techniques relevant to the architecture; enable Defender plans and Sentinel analytics accordingly.","stride":["repudiation"],"attack_techniques":["T1562"],"crosswalk":[{"framework_id":"nist-csf","control_id":"DE.CM"}]},
    {"control_id":"SE:11","title":"Test and validate security","summary":"Security is validated continuously through testing: SAST, DAST, pentesting, and chaos/attack simulation.","severity":"medium","domain":"Security Pillar","azure_services":[],"remediation":"Security gates in CI, periodic pentests, attack path analysis in Defender CSPM, and purple-team exercises.","stride":[],"attack_techniques":[],"crosswalk":[{"framework_id":"iso-27001","control_id":"A.8.28"}]},
    {"control_id":"SE:12","title":"Prepare incident response","summary":"The workload team can detect, respond to, and recover from incidents within agreed objectives.","severity":"medium","domain":"Security Pillar","azure_services":[],"remediation":"Workload-specific runbooks, contact matrix, automation for containment, and game-day rehearsals.","stride":[],"attack_techniques":[],"crosswalk":[{"framework_id":"nist-800-53","control_id":"IR-4"}]}
  ]
}
