{
  "framework_id": "soc2",
  "name": "SOC 2 Trust Services Criteria",
  "version": "2017 (with 2022 points of focus) — representative subset",
  "publisher": "AICPA",
  "category": "regulatory",
  "description": "Representative Common Criteria mapped to Azure implementations. Summaries are paraphrased.",
  "reference_url": "https://www.aicpa-cima.com/topic/audit-assurance/audit-and-assurance-greater-than-soc-2",
  "controls": [
    {"control_id":"CC6.1","title":"Logical access security","summary":"Logical access to systems and data is restricted through security software, infrastructure, and architectures.","severity":"high","domain":"Common Criteria","azure_services":["entra-id"],"remediation":"Entra ID SSO with MFA and Conditional Access, RBAC least privilege, network restrictions on data services.","stride":["spoofing","elevation-of-privilege"],"attack_techniques":["T1078"],"crosswalk":[{"framework_id":"nist-800-53","control_id":"AC-3"}]},
    {"control_id":"CC6.6","title":"Boundary protection","summary":"Threats from outside system boundaries are mitigated at controlled entry points.","severity":"high","domain":"Common Criteria","azure_services":["app-gateway-waf","firewall"],"remediation":"WAF at ingress, Azure Firewall for egress, deny-by-default NSGs, DDoS protection for public endpoints.","stride":["denial-of-service","tampering"],"attack_techniques":["T1190"],"crosswalk":[{"framework_id":"nist-800-53","control_id":"SC-7"}]},
    {"control_id":"CC6.7","title":"Data transmission and movement","summary":"Data in transit and on removable/portable media is protected.","severity":"high","domain":"Common Criteria","azure_services":[],"remediation":"TLS 1.2+ on all channels, private endpoints for internal data paths, encrypted exports only.","stride":["information-disclosure"],"attack_techniques":["T1557"],"crosswalk":[{"framework_id":"mcsb","control_id":"DP-3"}]},
    {"control_id":"CC7.1","title":"Vulnerability detection","summary":"Configuration changes and new vulnerabilities are detected and evaluated.","severity":"high","domain":"Common Criteria","azure_services":["defender-for-cloud"],"remediation":"Defender vulnerability management, CI dependency/image scanning, and Azure Policy drift detection.","stride":["tampering"],"attack_techniques":["T1190"],"crosswalk":[{"framework_id":"nist-800-53","control_id":"SI-2"}]},
    {"control_id":"CC7.2","title":"Anomaly monitoring","summary":"System components are monitored for anomalies indicating malicious acts or errors.","severity":"high","domain":"Common Criteria","azure_services":["log-analytics","defender-for-cloud"],"remediation":"Centralized logging with analytics rules, alert triage runbooks, and retention meeting audit requirements.","stride":["repudiation"],"attack_techniques":["T1562"],"crosswalk":[{"framework_id":"nist-csf","control_id":"DE.CM"}]},
    {"control_id":"CC7.4","title":"Incident response","summary":"Security incidents are responded to through an understood program of containment, remediation, and communication.","severity":"medium","domain":"Common Criteria","azure_services":[],"remediation":"Documented IR plan with roles, Sentinel/Defender automation for containment, and stakeholder communication templates.","stride":[],"attack_techniques":[],"crosswalk":[{"framework_id":"nist-800-53","control_id":"IR-4"}]},
    {"control_id":"CC8.1","title":"Change management","summary":"Infrastructure, data, and software changes are authorized, designed, tested, approved, and implemented in a controlled way.","severity":"medium","domain":"Common Criteria","azure_services":[],"remediation":"All changes via PR-reviewed IaC and pipelines, environment promotion gates, and audit trail in GitHub.","stride":["tampering"],"attack_techniques":["T1195"],"crosswalk":[{"framework_id":"nist-800-53","control_id":"CM-2"}]},
    {"control_id":"A1.2","title":"Availability — recovery infrastructure","summary":"Recovery infrastructure and data backup processes support availability commitments.","severity":"medium","domain":"Availability","azure_services":["azure-sql"],"remediation":"Zone redundancy for critical tiers, geo-backup, documented RTO/RPO, and restore testing.","stride":["denial-of-service"],"attack_techniques":["T1490"],"crosswalk":[{"framework_id":"nist-800-53","control_id":"CP-9"}]}
  ]
}
