{
  "framework_id": "mitre-attack-azure",
  "name": "MITRE ATT&CK & ATLAS — Azure Technique Mappings",
  "version": "ATT&CK v15 / ATLAS 2024 (representative subset)",
  "publisher": "MITRE",
  "category": "threat-model",
  "description": "Adversary techniques mapped to the Azure services they target and the controls that mitigate them. ATT&CK techniques use Txxxx IDs; ATLAS (AI-specific) techniques use AML.Txxxx IDs. Summaries are paraphrased.",
  "reference_url": "https://attack.mitre.org/",
  "controls": [
    {"control_id":"T1078","title":"Valid Accounts","summary":"Adversaries use legitimate credentials to gain access, blending in with normal activity.","severity":"critical","domain":"Initial Access / Persistence","azure_services":["entra-id"],"remediation":"Enforce MFA and Conditional Access, monitor risky sign-ins, use PIM, and disable stale accounts.","stride":["spoofing"],"attack_techniques":["T1078"],"crosswalk":[{"framework_id":"cis-azure","control_id":"CIS-2.1.1"},{"framework_id":"nist-800-53","control_id":"IA-2(1)"}]},
    {"control_id":"T1110","title":"Brute Force","summary":"Adversaries guess or spray passwords to obtain valid credentials.","severity":"high","domain":"Credential Access","azure_services":["entra-id"],"remediation":"Smart lockout, banned-password protection, MFA, and block legacy authentication.","stride":["spoofing"],"attack_techniques":["T1110"],"crosswalk":[{"framework_id":"cis-azure","control_id":"CIS-2.3"}]},
    {"control_id":"T1133","title":"External Remote Services","summary":"Adversaries exploit internet-exposed remote access services (RDP/SSH/VPN) for entry.","severity":"critical","domain":"Initial Access","azure_services":["vnet","virtual-machine"],"remediation":"Remove public management ports, use Azure Bastion and JIT VM access, and require MFA on VPN.","stride":["elevation-of-privilege"],"attack_techniques":["T1133"],"crosswalk":[{"framework_id":"cis-azure","control_id":"CIS-6.1"}]},
    {"control_id":"T1190","title":"Exploit Public-Facing Application","summary":"Adversaries exploit vulnerabilities in internet-facing applications to gain initial access.","severity":"critical","domain":"Initial Access","azure_services":["app-service","app-gateway-waf","apim"],"remediation":"WAF in prevention mode, patch SLAs, SAST/SCA gates, and least-privilege app identities.","stride":["tampering","elevation-of-privilege"],"attack_techniques":["T1190"],"crosswalk":[{"framework_id":"owasp-web-top10","control_id":"A03"},{"framework_id":"nist-800-53","control_id":"SC-7"}]},
    {"control_id":"T1530","title":"Data from Cloud Storage","summary":"Adversaries access improperly secured cloud storage objects to steal data.","severity":"high","domain":"Collection","azure_services":["storage-account"],"remediation":"Disable public/anonymous access, require private endpoints, enable logging, and alert on mass access.","stride":["information-disclosure"],"attack_techniques":["T1530"],"crosswalk":[{"framework_id":"cis-azure","control_id":"CIS-4.1.4"}]},
    {"control_id":"T1552","title":"Unsecured Credentials","summary":"Adversaries search files, config, and services for exposed secrets and keys.","severity":"high","domain":"Credential Access","azure_services":["key-vault","app-service"],"remediation":"Managed identities instead of stored secrets, Key Vault with restricted access, and secret scanning in CI.","stride":["information-disclosure"],"attack_techniques":["T1552"],"crosswalk":[{"framework_id":"mcsb","control_id":"DP-8"}]},
    {"control_id":"T1557","title":"Adversary-in-the-Middle","summary":"Adversaries intercept traffic to capture credentials or manipulate data in transit.","severity":"high","domain":"Credential Access / Collection","azure_services":[],"remediation":"Enforce TLS 1.2+, HSTS, certificate validation, and private connectivity for internal paths.","stride":["information-disclosure","tampering"],"attack_techniques":["T1557"],"crosswalk":[{"framework_id":"nist-800-53","control_id":"SC-8"}]},
    {"control_id":"T1498","title":"Network Denial of Service","summary":"Adversaries flood network resources to degrade or deny availability.","severity":"medium","domain":"Impact","azure_services":["front-door","app-gateway-waf"],"remediation":"Azure DDoS Protection, edge caching via Front Door, WAF rate limiting, and autoscaling.","stride":["denial-of-service"],"attack_techniques":["T1498"],"crosswalk":[{"framework_id":"nist-800-53","control_id":"SC-5"}]},
    {"control_id":"T1562.001","title":"Impair Defenses: Disable or Modify Tools","summary":"Adversaries disable security tooling or logging to evade detection.","severity":"high","domain":"Defense Evasion","azure_services":["defender-for-cloud","log-analytics"],"remediation":"Lock diagnostic settings via policy, alert on log/Defender configuration changes, and use immutable log storage.","stride":["tampering","repudiation"],"attack_techniques":["T1562.001"],"crosswalk":[{"framework_id":"mcsb","control_id":"LT-1"}]},
    {"control_id":"T1485","title":"Data Destruction","summary":"Adversaries destroy data and backups to disrupt availability (including ransomware).","severity":"high","domain":"Impact","azure_services":["storage-account","key-vault","azure-sql"],"remediation":"Immutable/soft-delete storage, Key Vault purge protection, geo-redundant tested backups, and resource locks.","stride":["denial-of-service","tampering"],"attack_techniques":["T1485"],"crosswalk":[{"framework_id":"cis-azure","control_id":"CIS-8.4"}]},
    {"control_id":"AML.T0051","title":"LLM Prompt Injection","summary":"Adversaries craft inputs (direct or indirect) that override an LLM's instructions or coerce tool misuse.","severity":"critical","domain":"ATLAS — ML Attack Staging","azure_services":["azure-openai"],"remediation":"Separate system and user content, treat retrieved/tool data as untrusted, apply Prompt Shields, and gate consequential actions behind human approval.","stride":["tampering","elevation-of-privilege"],"attack_techniques":["AML.T0051"],"crosswalk":[{"framework_id":"owasp-llm-top10","control_id":"LLM01"}]},
    {"control_id":"AML.T0057","title":"LLM Data Leakage","summary":"Adversaries extract sensitive data from an LLM's context, connected tools, or training data.","severity":"high","domain":"ATLAS — Exfiltration","azure_services":["azure-openai"],"remediation":"Minimize sensitive context, apply output DLP, scope tool authorization per user, and monitor for extraction patterns.","stride":["information-disclosure"],"attack_techniques":["AML.T0057"],"crosswalk":[{"framework_id":"owasp-llm-top10","control_id":"LLM02"}]},
    {"control_id":"AML.T0053","title":"LLM Plugin Compromise / Excessive Agency","summary":"Adversaries abuse over-permissioned model tools/plugins to take unintended actions.","severity":"high","domain":"ATLAS — Execution","azure_services":["azure-openai"],"remediation":"Allow-list tools per role, least-privilege tool scopes, human confirmation for destructive operations, and full tool-call auditing.","stride":["elevation-of-privilege"],"attack_techniques":["AML.T0053"],"crosswalk":[{"framework_id":"owasp-llm-top10","control_id":"LLM06"}]},
    {"control_id":"AML.T0034","title":"Cost Harvesting","summary":"Adversaries drive excessive model inference to cause denial of service or runaway cost.","severity":"medium","domain":"ATLAS — Impact","azure_services":["azure-openai","apim"],"remediation":"Per-user rate limits and token budgets, APIM in front of Azure OpenAI, and spend alerts.","stride":["denial-of-service"],"attack_techniques":["AML.T0034"],"crosswalk":[{"framework_id":"owasp-llm-top10","control_id":"LLM10"}]}
  ]
}
