{
  "framework_id": "iso-27001",
  "name": "ISO/IEC 27001:2022 Annex A Controls",
  "version": "2022 (representative subset)",
  "publisher": "ISO/IEC",
  "category": "standard",
  "description": "Representative Annex A information security controls mapped to Azure. Summaries are paraphrased; the standard itself is licensed content.",
  "reference_url": "https://www.iso.org/standard/27001",
  "controls": [
    {"control_id":"A.5.1","title":"Policies for information security","summary":"Management-approved security policies exist, are communicated, and reviewed.","severity":"medium","domain":"Organizational","azure_services":[],"remediation":"Maintain versioned security policies in the repo/wiki, map them to Azure Policy assignments, and review annually.","stride":[],"attack_techniques":[],"crosswalk":[{"framework_id":"nist-csf","control_id":"GV.RM"}]},
    {"control_id":"A.5.9","title":"Inventory of information and assets","summary":"Information and associated assets are inventoried with assigned owners.","severity":"medium","domain":"Organizational","azure_services":[],"remediation":"Mandatory owner/classification tags via Azure Policy; export inventory with Resource Graph.","stride":[],"attack_techniques":[],"crosswalk":[{"framework_id":"nist-csf","control_id":"ID.AM"}]},
    {"control_id":"A.5.15","title":"Access control","summary":"Rules limiting access to information and assets are established and enforced.","severity":"high","domain":"Organizational","azure_services":["entra-id"],"remediation":"RBAC with least privilege, Conditional Access, and documented access-control rules per data classification.","stride":["elevation-of-privilege"],"attack_techniques":["T1078"],"crosswalk":[{"framework_id":"nist-800-53","control_id":"AC-3"}]},
    {"control_id":"A.5.16","title":"Identity management","summary":"Identity lifecycle (joiner/mover/leaver) is managed for people and systems.","severity":"high","domain":"Organizational","azure_services":["entra-id"],"remediation":"HR-driven provisioning to Entra ID, automatic deprovisioning, and workload identities via managed identity.","stride":["spoofing"],"attack_techniques":["T1078"],"crosswalk":[{"framework_id":"nist-800-53","control_id":"AC-2"}]},
    {"control_id":"A.5.17","title":"Authentication information","summary":"Credentials are allocated and managed securely; users are guided on handling them.","severity":"high","domain":"Organizational","azure_services":["entra-id","key-vault"],"remediation":"MFA enforcement, banned-password lists, secrets in Key Vault with rotation, no shared credentials.","stride":["spoofing"],"attack_techniques":["T1110"],"crosswalk":[{"framework_id":"cis-azure","control_id":"CIS-2.1.1"}]},
    {"control_id":"A.8.2","title":"Privileged access rights","summary":"Privileged access is restricted, allocated on need, and reviewed.","severity":"high","domain":"Technological","azure_services":["entra-id"],"remediation":"PIM eligible assignments with approval and MFA, quarterly privileged access reviews.","stride":["elevation-of-privilege"],"attack_techniques":["T1098"],"crosswalk":[{"framework_id":"mcsb","control_id":"PA-1"}]},
    {"control_id":"A.8.12","title":"Data leakage prevention","summary":"Measures detect and prevent unauthorized disclosure of sensitive information.","severity":"medium","domain":"Technological","azure_services":["storage-account"],"remediation":"Purview classification/DLP, block public blob access, egress control via Firewall, and alert on mass-download anomalies.","stride":["information-disclosure"],"attack_techniques":["T1530","T1048"],"crosswalk":[{"framework_id":"nist-csf","control_id":"PR.DS"}]},
    {"control_id":"A.8.13","title":"Information backup","summary":"Backups are maintained and tested per the agreed policy.","severity":"high","domain":"Technological","azure_services":["azure-sql","storage-account"],"remediation":"Azure Backup/PITR with immutability, offsite copies, and scheduled restore testing.","stride":["denial-of-service"],"attack_techniques":["T1485"],"crosswalk":[{"framework_id":"nist-800-53","control_id":"CP-9"}]},
    {"control_id":"A.8.16","title":"Monitoring activities","summary":"Networks, systems, and applications are monitored for anomalous behavior.","severity":"high","domain":"Technological","azure_services":["log-analytics","defender-for-cloud"],"remediation":"Diagnostic settings to Log Analytics, Defender alerts, Sentinel analytics, and defined triage ownership.","stride":["repudiation"],"attack_techniques":["T1562"],"crosswalk":[{"framework_id":"nist-csf","control_id":"DE.CM"}]},
    {"control_id":"A.8.24","title":"Use of cryptography","summary":"Cryptography rules, including key management, are defined and implemented.","severity":"high","domain":"Technological","azure_services":["key-vault"],"remediation":"Document crypto standards (TLS 1.2+, AES-256), manage keys in Key Vault/Managed HSM with rotation.","stride":["information-disclosure"],"attack_techniques":["T1552.004"],"crosswalk":[{"framework_id":"nist-800-53","control_id":"SC-12"}]},
    {"control_id":"A.8.28","title":"Secure coding","summary":"Secure coding principles are applied to software development.","severity":"high","domain":"Technological","azure_services":[],"remediation":"SAST/SCA in CI, code review gates, input validation standards, and OWASP training for developers.","stride":["tampering"],"attack_techniques":["T1190"],"crosswalk":[{"framework_id":"owasp-web-top10","control_id":"A03"}]}
  ]
}
